{
  "schema_version": "site2voice.site.v1",
  "generator": "site2voice/0.5.6",
  "source": "https://www.eyesmag.com/about",
  "site_summary": {
    "page_archetype": "editorial index",
    "information_density": "balanced",
    "conversion_pressure": "low",
    "navigation_model": "focused product navigation",
    "content_boundary": "Structure and copy shape only. Bring new project nouns, facts, claims, audience, domain, and offers."
  },
  "structure_metrics": {
    "words": 769,
    "headings": 1,
    "ctas": 1,
    "links": 8,
    "avg_heading_words": 1,
    "avg_paragraph_words": 16.2,
    "avg_cta_words": 2,
    "avg_link_words": 1.4
  },
  "measurement_note": "Numeric ranges are drift checks for benchmarking, not the primary writing method.",
  "target_ranges": {
    "heading_words": {
      "target": 1.0,
      "min": 1.0,
      "max": 1.2
    },
    "paragraph_words": {
      "target": 16.2,
      "min": 12.1,
      "max": 20.2
    },
    "cta_words": {
      "target": 2.0,
      "min": 1.5,
      "max": 2.5
    }
  },
  "page_blueprint": [
    {
      "order": 1,
      "slot": "navigation",
      "goal": "Orient the reader before the first claim.",
      "copy_shape": "Use short noun-led labels; keep utility paths separate from product paths."
    },
    {
      "order": 2,
      "slot": "first_screen",
      "goal": "State the main outcome and give a visible next action.",
      "copy_shape": "Specific headline, one compact value sentence, and one or two action CTAs."
    },
    {
      "order": 3,
      "slot": "feed_index",
      "goal": "Turn many topics into a scannable editorial path.",
      "copy_shape": "Short section labels, compact summaries, clear onward links."
    },
    {
      "order": 4,
      "slot": "proof_band",
      "goal": "Make the promise believable without overclaiming.",
      "copy_shape": "Use concrete evidence blocks: metric, customer type, workflow step, or product constraint."
    },
    {
      "order": 5,
      "slot": "detail_sections",
      "goal": "Give deeper readers enough structure to evaluate fit.",
      "copy_shape": "Alternate short headings with one-paragraph explanations and compact lists."
    },
    {
      "order": 6,
      "slot": "footer",
      "goal": "Close with utility, trust, and legal/support paths.",
      "copy_shape": "Grouped utility links with short labels and no marketing prose."
    }
  ],
  "section_recipes": [
    {
      "slot": "navigation",
      "goal": "Orient the reader before the first claim.",
      "copy_shape": "Use short noun-led labels; keep utility paths separate from product paths.",
      "agent_rule": "Use navigation categories from the new product, not the reference source."
    },
    {
      "slot": "first_screen",
      "goal": "State the main outcome and give a visible next action.",
      "copy_shape": "Specific headline, one compact value sentence, and one or two action CTAs.",
      "agent_rule": "Name the new outcome plainly before explaining features."
    },
    {
      "slot": "feed_index",
      "goal": "Turn many topics into a scannable editorial path.",
      "copy_shape": "Short section labels, compact summaries, clear onward links.",
      "agent_rule": "Use the structure for topic grouping only; bring new subjects and article angles."
    },
    {
      "slot": "proof_band",
      "goal": "Make the promise believable without overclaiming.",
      "copy_shape": "Use concrete evidence blocks: metric, customer type, workflow step, or product constraint.",
      "agent_rule": "Only include proof that the new project can independently support."
    },
    {
      "slot": "detail_sections",
      "goal": "Give deeper readers enough structure to evaluate fit.",
      "copy_shape": "Alternate short headings with one-paragraph explanations and compact lists.",
      "agent_rule": "Split detail by user job, workflow step, or decision criterion."
    },
    {
      "slot": "footer",
      "goal": "Close with utility, trust, and legal/support paths.",
      "copy_shape": "Grouped utility links with short labels and no marketing prose.",
      "agent_rule": "Use owned support, policy, company, and resource links."
    }
  ],
  "agent_instructions": [
    "Use SITE.md for page structure and section order.",
    "Use VOICE.md for sentence rhythm, CTA shape, and benchmark gates.",
    "Treat the new project brief as the only source of product category, audience, domain nouns, examples, offers, and claims.",
    "Replace every topic, product noun, market claim, price, and proof point with facts from the new project.",
    "Do not imply affiliation with, endorsement from, or official representation of the reference source.",
    "If a needed fact is missing, write a neutral placeholder or remove the claim."
  ],
  "anti_patterns": [
    "Do not copy source headings, CTA labels, navigation labels, slogans, or campaign names.",
    "Do not import the reference site's product catalog, category, audience, pricing, legal claims, feature names, people, events, or cultural context.",
    "Do not turn structure guidance into a visual design system.",
    "Do not add urgency, security, performance, customer, or compliance claims without evidence."
  ]
}
